{
    "intentVersion": "0.1",
    "intentId": "0x7f2b8a8d5d6d6f2b1b1c2d3e4f5a6b7c8d9e0f1a2b3c4d5e6f7081920a0b0c0d",
    "smartAccount": "0x1111111111111111111111111111111111111111",
    "chainId": 8453,
    "deadline": 1777777777,
    "input": {
        "token": "0xA0b86991c6218b36c1d19d4a2e9eb0ce3606eb48",
        "amount": "1000000000"
    },
    "outputs": [
        {
            "token": "0xC02aaA39b223FE8D0A0E5C4F27eAD9083C756Cc2",
            "minAmount": "250000000000000000",
            "recipient": "0x1111111111111111111111111111111111111111"
        }
    ],
    "constraints": {
        "slippageBps": 50,
        "maxSpend": "0",
        "nonceSalt": "0x0000000000000000000000000000000000000000000000000000000000000000"
    },
    "priorityFee": {
        "token": "HIEF",
        "amount": "0"
    },
    "policyRef": {
        "policyVersion": "pol-0.1.3",
        "policyHash": "0x9a8b7c6d5e4f00112233445566778899aabbccddeeff00112233445566778899"
    },
    "reputationSnapshotRef": {
        "type": "block",
        "value": "12345678"
    },
    "meta": {
        "title": "USDC -> WETH with <=0.5% slippage",
        "userIntentText": "把 1000 USDC 换成尽可能多的 WETH，滑点不超过 0.5%"
    },
    "extensions": {
        "note": "v0.1 single-chain"
    },
    "signature": {
        "type": "SAFE",
        "signer": "0x1111111111111111111111111111111111111111",
        "sig": "0x<SAFE_SIGNATURE_PLACEHOLDER>"
    }
}
